{"build":"device-diagnostics-20260908-C","schemaVersion":"spoken-margins.developer-recording.v1","captureID":"4C1A7D95-2C0C-4CF9-8833-03C8BFC05205","events":[{"time":"2026-09-08T13:39:39.444Z","elapsedMs":3,"fields":{},"kind":"recording.started"},{"time":"2026-09-08T13:39:40.005Z","elapsedMs":560,"fields":{"intervalMs":"528","status":"idle","openingState":"Optional(SpokenMarginsApp.NativeTextStartupAudioState.notRequired)","openingChunks":"0","item":"none","textOffset":"0","canPrepare":"true","generatedChunks":"0","target":"none","selected":"8cd88cb012e1a048","workerActive":"false","openingTarget":"0","queueCount":"0","generation":"inactive","thermal":"0","screen":"settings","totalChunks":"0","lowPower":"false"},"kind":"sample"},{"time":"2026-09-08T13:39:40.516Z","elapsedMs":1072,"fields":{"intervalMs":"525","status":"idle","openingState":"Optional(SpokenMarginsApp.NativeTextStartupAudioState.notRequired)","openingChunks":"0","selected":"8cd88cb012e1a048","textOffset":"0","item":"none","canPrepare":"true","target":"none","generatedChunks":"0","workerActive":"false","openingTarget":"0","queueCount":"0","thermal":"0","generation":"inactive","screen":"settings","totalChunks":"0","lowPower":"false"},"kind":"sample"},{"time":"2026-09-08T13:39:41.050Z","elapsedMs":1605,"fields":{"intervalMs":"534","status":"idle","openingState":"Optional(SpokenMarginsApp.NativeTextStartupAudioState.notRequired)","openingChunks":"0","item":"none","textOffset":"0","generatedChunks":"0","canPrepare":"true","target":"none","selected":"8cd88cb012e1a048","workerActive":"false","openingTarget":"0","generation":"inactive","thermal":"0","screen":"settings","queueCount":"0","totalChunks":"0","lowPower":"false"},"kind":"sample"},{"elapsedMs":2124,"fields":{"intervalMs":"518","status":"idle","openingState":"Optional(SpokenMarginsApp.NativeTextStartupAudioState.notRequired)","openingChunks":"0","item":"none","generatedChunks":"0","canPrepare":"true","textOffset":"0","target":"none","selected":"8cd88cb012e1a048","workerActive":"false","openingTarget":"0","queueCount":"0","thermal":"0","screen":"home","generation":"inactive","totalChunks":"0","lowPower":"false"},"kind":"sample","time":"2026-09-08T13:39:41.568Z"},{"elapsedMs":2658,"fields":{"intervalMs":"534","status":"idle","openingState":"Optional(SpokenMarginsApp.NativeTextStartupAudioState.notRequired)","openingChunks":"0","item":"none","generatedChunks":"0","canPrepare":"true","textOffset":"0","target":"none","selected":"8cd88cb012e1a048","workerActive":"false","openingTarget":"0","queueCount":"0","thermal":"0","screen":"home","generation":"inactive","totalChunks":"0","lowPower":"false"},"kind":"sample","time":"2026-09-08T13:39:42.103Z"},{"fields":{"item":"none","canPrepare":"true","workerActive":"false","openingState":"Optional(SpokenMarginsApp.NativeTextStartupAudioState.notRequired)","openingTarget":"0","queueCount":"0","textOffset":"0","totalChunks":"0","intervalMs":"518","thermal":"0","target":"none","screen":"home","selected":"8cd88cb012e1a048","generation":"inactive","status":"idle","lowPower":"false","generatedChunks":"0","openingChunks":"0"},"kind":"sample","time":"2026-09-08T13:39:42.621Z","elapsedMs":3177},{"fields":{"status":"idle","openingChunks":"0","workerActive":"false","openingState":"Optional(SpokenMarginsApp.NativeTextStartupAudioState.notRequired)","queueCount":"0","openingTarget":"0","textOffset":"0","totalChunks":"0","intervalMs":"521","thermal":"0","target":"none","screen":"home","selected":"8cd88cb012e1a048","generation":"inactive","item":"none","generatedChunks":"0","lowPower":"false","canPrepare":"true"},"kind":"sample","time":"2026-09-08T13:39:43.143Z","elapsedMs":3698},{"fields":{"openingChunks":"0","generatedChunks":"0","workerActive":"false","openingState":"Optional(SpokenMarginsApp.NativeTextStartupAudioState.notRequired)","openingTarget":"0","queueCount":"0","textOffset":"0","totalChunks":"0","intervalMs":"530","thermal":"0","screen":"home","target":"none","generation":"inactive","lowPower":"false","item":"none","status":"idle","selected":"8cd88cb012e1a048","canPrepare":"true"},"kind":"sample","time":"2026-09-08T13:39:43.673Z","elapsedMs":4229},{"time":"2026-09-08T13:39:44.242Z","kind":"sample","fields":{"openingChunks":"0","selected":"8cd88cb012e1a048","workerActive":"false","openingState":"Optional(SpokenMarginsApp.NativeTextStartupAudioState.notRequired)","queueCount":"0","openingTarget":"0","textOffset":"0","totalChunks":"58","intervalMs":"568","thermal":"0","target":"8cd88cb012e1a048","screen":"playback","generation":"rendering","generatedChunks":"0","item":"8cd88cb012e1a048","status":"starting","lowPower":"false","canPrepare":"false"},"elapsedMs":4798},{"time":"2026-09-08T13:39:44.746Z","kind":"scrub.text.display","fields":{"canonical":"2.0","editing":"false","range":"9430.0","displayed":"2.0"},"elapsedMs":5302},{"time":"2026-09-08T13:39:44.754Z","kind":"sample","fields":{"openingChunks":"0","selected":"8cd88cb012e1a048","workerActive":"false","openingTarget":"0","queueCount":"0","openingState":"Optional(SpokenMarginsApp.NativeTextStartupAudioState.notRequired)","textOffset":"2","totalChunks":"58","intervalMs":"512","thermal":"0","target":"8cd88cb012e1a048","screen":"playback","generation":"rendering","lowPower":"false","item":"8cd88cb012e1a048","status":"playing","generatedChunks":"18","canPrepare":"true"},"elapsedMs":5310},{"time":"2026-09-08T13:39:45.254Z","kind":"scrub.text.display","fields":{"range":"9430.0","displayed":"10.0","canonical":"10.0","editing":"false"},"elapsedMs":5810},{"time":"2026-09-08T13:39:45.259Z","kind":"sample","fields":{"item":"8cd88cb012e1a048","openingChunks":"0","screen":"playback","status":"playing","textOffset":"10","totalChunks":"58","generatedChunks":"40","openingTarget":"0","lowPower":"false","selected":"8cd88cb012e1a048","canPrepare":"true","workerActive":"false","target":"8cd88cb012e1a048","generation":"rendering","intervalMs":"505","openingState":"Optional(SpokenMarginsApp.NativeTextStartupAudioState.notRequired)","queueCount":"0","thermal":"0"},"elapsedMs":5815},{"time":"2026-09-08T13:39:45.776Z","kind":"sample","fields":{"item":"8cd88cb012e1a048","openingChunks":"0","screen":"playback","status":"playing","openingTarget":"0","totalChunks":"58","generatedChunks":"58","textOffset":"10","lowPower":"false","canPrepare":"true","selected":"8cd88cb012e1a048","workerActive":"false","target":"8cd88cb012e1a048","generation":"rendering","intervalMs":"516","openingState":"Optional(SpokenMarginsApp.NativeTextStartupAudioState.notRequired)","queueCount":"0","thermal":"0"},"elapsedMs":6332},{"time":"2026-09-08T13:39:45.781Z","kind":"scrub.text.display","fields":{"editing":"false","range":"9430.0","canonical":"17.0","displayed":"17.0"},"elapsedMs":6337},{"time":"2026-09-08T13:39:46.277Z","kind":"sample","fields":{"item":"8cd88cb012e1a048","openingChunks":"0","screen":"playback","openingTarget":"0","textOffset":"17","status":"playing","generatedChunks":"58","totalChunks":"58","lowPower":"false","selected":"8cd88cb012e1a048","workerActive":"false","canPrepare":"true","target":"8cd88cb012e1a048","generation":"rendering","intervalMs":"500","openingState":"Optional(SpokenMarginsApp.NativeTextStartupAudioState.notRequired)","thermal":"0","queueCount":"0"},"elapsedMs":6833},{"kind":"scrub.text.display","fields":{"displayed":"24.0","editing":"false","range":"9430.0","canonical":"24.0"},"elapsedMs":6850,"time":"2026-09-08T13:39:46.294Z"},{"kind":"sample","fields":{"item":"8cd88cb012e1a048","openingChunks":"0","screen":"playback","status":"playing","openingTarget":"0","textOffset":"24","generatedChunks":"58","lowPower":"false","totalChunks":"58","selected":"8cd88cb012e1a048","workerActive":"false","canPrepare":"true","target":"8cd88cb012e1a048","generation":"rendering","intervalMs":"502","openingState":"Optional(SpokenMarginsApp.NativeTextStartupAudioState.notRequired)","queueCount":"0","thermal":"0"},"elapsedMs":7335,"time":"2026-09-08T13:39:46.780Z"},{"kind":"scrub.text.display","fields":{"canonical":"32.0","range":"9430.0","displayed":"32.0","editing":"false"},"elapsedMs":7369,"time":"2026-09-08T13:39:46.813Z"},{"kind":"scrub.text.editing","fields":{"editing":"true"},"elapsedMs":7581,"time":"2026-09-08T13:39:47.025Z"},{"kind":"scrub.text.drag","fields":{"value":"0.0","canonical":"32.0","range":"9430.0"},"elapsedMs":7581,"time":"2026-09-08T13:39:47.025Z"},{"kind":"scrub.text.drag","fields":{"range":"9430.0","value":"70.37313079833984","canonical":"32.0"},"elapsedMs":7657,"time":"2026-09-08T13:39:47.102Z"},{"kind":"scrub.text.drag","fields":{"range":"9430.0","value":"226.75787353515625","canonical":"32.0"},"elapsedMs":7691,"time":"2026-09-08T13:39:47.135Z"},{"kind":"scrub.text.drag","fields":{"range":"9430.0","value":"586.4427490234375","canonical":"32.0"},"elapsedMs":7707,"time":"2026-09-08T13:39:47.152Z"},{"fields":{"range":"9430.0","value":"977.4046630859375","canonical":"32.0"},"time":"2026-09-08T13:39:47.185Z","kind":"scrub.text.drag","elapsedMs":7741},{"fields":{"range":"9430.0","canonical":"32.0","value":"1180.7047119140625"},"time":"2026-09-08T13:39:47.218Z","kind":"scrub.text.drag","elapsedMs":7774},{"fields":{"range":"9430.0","canonical":"32.0","value":"1384.0050048828125"},"time":"2026-09-08T13:39:47.235Z","kind":"scrub.text.drag","elapsedMs":7791},{"fields":{"value":"1602.943603515625","canonical":"32.0","range":"9430.0"},"time":"2026-09-08T13:39:47.252Z","kind":"scrub.text.drag","elapsedMs":7807},{"fields":{"range":"9430.0","canonical":"32.0","value":"2025.182373046875"},"time":"2026-09-08T13:39:47.268Z","kind":"scrub.text.drag","elapsedMs":7824},{"fields":{"thermal":"0","status":"playing","totalChunks":"58","screen":"playback","generation":"rendering","queueCount":"0","openingState":"Optional(SpokenMarginsApp.NativeTextStartupAudioState.notRequired)","openingTarget":"0","item":"8cd88cb012e1a048","openingChunks":"0","textOffset":"32","generatedChunks":"58","lowPower":"false","target":"8cd88cb012e1a048","selected":"8cd88cb012e1a0